{
  "schema_version": "1.0.0",
  "dataset_id": "sample-dataset",
  "report_id": "sample-coverage-report-001",
  "generated_at": "2026-07-17T00:15:00Z",
  "summary": {
    "total_videos": 1,
    "total_duration_ms": 120000,
    "total_candidate_samples": 2,
    "event_samples": 1,
    "background_samples": 1,
    "reviewed_samples": 2,
    "unreviewed_samples": 0,
    "confirmed_samples": 1,
    "rejected_samples": 1,
    "needs_review_samples": 0,
    "annotation_completion_rate": 1.0,
    "confirmed_rate": 0.5,
    "valid_artifact_rate": 1.0
  },
  "by_event_label": {
    "background": 1,
    "intrusion_crossing": 1
  },
  "by_source_video": {
    "samplevideo01": {
      "samples": 2,
      "duration_ms": 120000
    }
  }
}
